{"Results":[{"RecordDateModified":{"IsClear":false,"IsTimeClear":false,"DateTime":"2025-03-04T22:06:17.0000000Z","StringValue":"2025-03-04 at 5:06 PM"},"RecordExtension":{"Value":"PDF"},"RecordTitle":{"Value":"dec_order_cost awards_Green Button_20250304_esigned"},"TrimType":"Record","Uri":891285,"Fields":{"CaseNumber":{"__type":"HP.HPTRIM.ServiceModel.TrimStringProperty, TRIMServiceAPIModel","Value":"EB-2021-0183"},"SIDocumentType":{"__type":"HP.HPTRIM.ServiceModel.TrimStringProperty, TRIMServiceAPIModel","Value":"Decision and Order on Cost Awards"},"Applicant":{"__type":"HP.HPTRIM.ServiceModel.LocationRef, TRIMServiceAPIModel","LocationFormattedName":{"Value":"Ontario Energy Board"},"TrimType":"Location","Uri":1087},"EnergyType":{"__type":"HP.HPTRIM.ServiceModel.TrimStringProperty, TRIMServiceAPIModel","Value":"Electricity"},"PrimaryApplicationType":{"__type":"HP.HPTRIM.ServiceModel.TrimStringProperty, TRIMServiceAPIModel","Value":"Initiatives"},"DateIssued":{"__type":"HP.HPTRIM.ServiceModel.TrimDateTime, TRIMServiceAPIModel","IsClear":false,"IsTimeClear":true,"DateTime":"2025-03-04T00:00:00.0000000Z"},"fDateReceived":{"__type":"HP.HPTRIM.ServiceModel.TrimDateTime, TRIMServiceAPIModel","IsClear":true,"IsTimeClear":true,"DateTime":"0001-01-01T00:00:00.0000000Z"}}},{"RecordDateModified":{"IsClear":false,"IsTimeClear":false,"DateTime":"2025-03-03T19:45:41.0000000Z","StringValue":"2025-03-03 at 2:45 PM"},"RecordExtension":{"Value":"MSG"},"RecordTitle":{"Value":"PollutionProbe_Not Filing_Cost Claim_GB Implementation_20250128"},"TrimType":"Record","Uri":877046,"Fields":{"CaseNumber":{"__type":"HP.HPTRIM.ServiceModel.TrimStringProperty, TRIMServiceAPIModel","Value":"EB-2021-0183"},"SIDocumentType":{"__type":"HP.HPTRIM.ServiceModel.TrimStringProperty, TRIMServiceAPIModel","Value":"Correspondence"},"Applicant":{"__type":"HP.HPTRIM.ServiceModel.LocationRef, TRIMServiceAPIModel","LocationFormattedName":{"Value":"Ontario Energy Board"},"TrimType":"Location","Uri":1087},"EnergyType":{"__type":"HP.HPTRIM.ServiceModel.TrimStringProperty, TRIMServiceAPIModel","Value":"Electricity"},"PrimaryApplicationType":{"__type":"HP.HPTRIM.ServiceModel.TrimStringProperty, TRIMServiceAPIModel","Value":"Initiatives"},"DateIssued":{"__type":"HP.HPTRIM.ServiceModel.TrimDateTime, TRIMServiceAPIModel","IsClear":true,"IsTimeClear":true,"DateTime":"0001-01-01T00:00:00.0000000Z"},"fDateReceived":{"__type":"HP.HPTRIM.ServiceModel.TrimDateTime, TRIMServiceAPIModel","IsClear":false,"IsTimeClear":true,"DateTime":"2025-01-28T00:00:00.0000000Z"}}}],"PropertiesAndFields":{},"TotalResults":40,"CountStringEx":"40 records","MinimumCount":40,"Count":0,"HasMoreItems":true,"SearchTitle":"Records - CaseNumber\u003dEB-2021-0183 - 40 records","HitHighlightString":"","TrimType":"Record","ResponseStatus":{}}